{
  "client": {
    "id": "dubula-default",
    "name": "Dubula",
    "industry": "restaurant"
  },
  "branding": {
    "appName": "Dubula - Restaurant Training Assistant",
    "tagline": "Ask questions about restaurant service, food handling, and customer service",
    "botName": "Dubula",
    "logo": {
      "primary": "/assets/logos/dubula-logo.png",
      "favicon": "/assets/logos/dubula-favicon.ico",
      "width": 120,
      "height": 40
    }
  },
  "theme": {
    "colors": {
      "primary": "#8B4513",
      "secondary": "#DAA520",
      "accent": "#FF6347",
      "background": "#FFF8DC",
      "surface": "#FFFFFF",
      "text": {
        "primary": "#2C1810",
        "secondary": "#5D4E37",
        "muted": "#8B7355"
      }
    },
    "typography": {
      "fontFamily": {
        "primary": "Inter, -apple-system, BlinkMacSystemFont, sans-serif",
        "heading": "Playfair Display, Georgia, serif",
        "monospace": "Monaco, 'Cascadia Code', Consolas, monospace"
      },
      "fontSize": {
        "base": "16px",
        "small": "14px",
        "large": "18px"
      }
    },
    "borderRadius": "8px",
    "spacing": {
      "unit": 8
    }
  },
  "ui": {
    "layout": {
      "maxWidth": "1200px",
      "headerHeight": "80px",
      "sidebarWidth": "300px"
    },
    "chat": {
      "welcomeMessage": "Hello! I'm here to help you with restaurant service questions. What would you like to know?",
      "placeholder": "Ask me about restaurant service, food handling, or customer service...",
      "maxHeight": "600px",
      "showTimestamps": true,
      "showTypingIndicator": true,
      "allowFileUploads": false
    },
    "animations": {
      "enabled": true,
      "duration": "0.2s",
      "easing": "ease-in-out"
    }
  },
  "assistant": {
    "personality": {
      "tone": "helpful",
      "style": "conversational",
      "formality": "balanced"
    },
    "brandVoice": {
      "description": "Friendly and knowledgeable restaurant training assistant",
      "keyTraits": ["helpful", "knowledgeable", "approachable", "professional"],
      "dosList": [
        "Provide clear, actionable advice for restaurant operations",
        "Use industry-specific terminology appropriately",
        "Be encouraging and supportive to staff learning new concepts",
        "Reference specific examples when helpful"
      ],
      "dontsList": [
        "Give advice that could compromise food safety",
        "Be overly technical or intimidating",
        "Contradict established restaurant policies",
        "Provide information outside of restaurant/hospitality domain"
      ],
      "samplePhrases": [
        "Let me help you with that!",
        "Here's the best practice for this situation...",
        "That's a great question about restaurant service!",
        "I'd recommend following these steps..."
      ]
    },
    "responseSettings": {
      "maxLength": "medium",
      "includeExamples": true,
      "useEmojis": false,
      "askFollowUpQuestions": true,
      "showPrompt": false
    },
    "modelSettings": {
      "modelName": "gpt-3.5-turbo",
      "temperature": 0.7,
      "maxTokens": 3097,
      "retrievals": 4
    }
  }
}